은행,지점,주소,전화번호,구,위도,경도
iM뱅크(구 대구은행),DGB Mobile Bank,대구광역시 수성구 수성동2가 달구벌대로2310,053-755-8760,수성구,35.8593346720137,128.614970737568
iM뱅크(구 대구은행),가톨릭대학병원출장소,대구광역시 남구 대명동 두류공원로17길33,053-653-8811,남구,35.8441891121102,128.565825660965
iM뱅크(구 대구은행),경북대병원지점,대구광역시 중구 삼덕2가 동덕로130,053-421-8541,중구,35.8662511316347,128.604702568416
iM뱅크(구 대구은행),경북대지점,대구광역시 북구 산격동 대학로80,053-944-1081,북구,35.8890974884948,128.614322336303
iM뱅크(구 대구은행),계명대동산병원점,대구광역시 달서구 신당동 달구벌대로1035,053-581-6732,달서구,35.8539564853872,128.480225817638
iM뱅크(구 대구은행),계명대지점,대구광역시 달서구 신당동 달구벌대로1095,053-581-1262,달서구,35.8559055953885,128.484579003028
iM뱅크(구 대구은행),계산점,대구광역시 중구 계산동2가 서성로20,053-256-2850,중구,35.8683977346216,128.587294855683
iM뱅크(구 대구은행),광장지점,대구광역시 달서구 두류동 달구벌대로1698,053-558-2070,달서구,35.8551556445504,128.551568259913
iM뱅크(구 대구은행),구암점,대구광역시 북구 구암동 구암로32길6-20,053-322-4381,북구,35.9313220110944,128.55598812662
iM뱅크(구 대구은행),금호사수점,대구광역시 북구 사수동 한강로4길13-1,053-326-7740,북구,35.8954159398932,128.514880132362
iM뱅크(구 대구은행),남구청출장소,대구광역시 남구 봉덕동 이천로51,053-475-7154,남구,35.8457841445375,128.597259963486
iM뱅크(구 대구은행),남문시장지점,대구광역시 중구 남산동 중앙대로303,053-252-6101,중구,35.8604446509535,128.591805174776
iM뱅크(구 대구은행),내당동지점,대구광역시 서구 내당동 달서로1,053-558-0161,서구,35.8624466067651,128.571605625555
iM뱅크(구 대구은행),노변지점,대구광역시 수성구 시지동 시지로55,053-791-9233,수성구,35.8381608472985,128.696092166133
iM뱅크(구 대구은행),노원동지점,대구광역시 북구 노원동3가 노원로169,053-354-5321,북구,35.8993728592037,128.578587926528
iM뱅크(구 대구은행),다사지점,대구광역시 달성군 다사읍 달구벌대로879,053-588-6231,달성군,35.8579504249587,128.465570830906
iM뱅크(구 대구은행),달서구청출장소,대구광역시 달서구 월성동 학산로45,053-636-0695,달서구,35.8299155224738,128.532835550073
iM뱅크(구 대구은행),달성공단영업부,대구광역시 달성군 논공읍 논공중앙로33길17,053-615-4511,달성군,35.7310470207363,128.452291470743
iM뱅크(구 대구은행),달성군청출장소,대구광역시 달성군 논공읍 달성군청로33,053-616-2966,달성군,35.7746631676172,128.431389741374
iM뱅크(구 대구은행),대곡역점,대구광역시 달성군 화원읍 비슬로2723,053-639-3541,달성군,35.8098261377556,128.512688235782
iM뱅크(구 대구은행),대곡지점,대구광역시 달서구 도원동 도원로29,053-642-8383,달서구,35.807156428601,128.536031147409
iM뱅크(구 대구은행),대구경북과학기술원점,대구광역시 달성군 현풍읍 테크노중앙대로333,053-611-1061,달성군,35.7056377572321,128.455010688046
iM뱅크(구 대구은행),대구교육대점,대구광역시 남구 대명2동 중앙대로219,053-651-0491,남구,35.8514315842476,128.587739242975
iM뱅크(구 대구은행),대구국가산단지점,대구광역시 달성군 구지면 국가산단대로213,053-615-0371,달성군,35.6484235065439,128.417101262741
iM뱅크(구 대구은행),대구국제공항출장소,대구광역시 동구 지저동 공항로221,053-984-1977,동구,35.8991086837334,128.639261532187
iM뱅크(구 대구은행),대구도시개발공사점,대구광역시 북구 고성동3가 침산로73,053-351-0684,북구,35.8831754914486,128.58933888053
iM뱅크(구 대구은행),대구시산격청사점,대구광역시 북구 산격동 연암로40,053-431-2330,북구,35.8920272135629,128.598409309488
iM뱅크(구 대구은행),대구혁신도시지점,대구광역시 동구 동내동 동내로88,053-961-6748,동구,35.8786413247675,128.736127636075
iM뱅크(구 대구은행),대덕지점,대구광역시 남구 대명동 대명로195,053-627-1621,남구,35.83994807951,128.57876750149
iM뱅크(구 대구은행),대명동지점,대구광역시 남구 대명동 중앙대로147,053-621-6391,남구,35.8465235411095,128.590181200639
iM뱅크(구 대구은행),대봉브라보점,대구광역시 남구 이천동 명덕로308,053-476-6166,남구,35.854920943935,128.603705949222
iM뱅크(구 대구은행),대신동지점,대구광역시 중구 대신동 국채보상로469,053-554-5181,중구,35.8708465700081,128.581962368393
iM뱅크(구 대구은행),대현점,대구광역시 북구 대현동 대현남로6길20,053-943-1560,북구,35.8804280056035,128.608539613654
iM뱅크(구 대구은행),덕산지점,대구광역시 중구 남산4동 남산로61,053-252-4605,중구,35.8620605722486,128.582127469159
iM뱅크(구 대구은행),동구청지점,대구광역시 동구 신암동 아양로207,053-958-1101,동구,35.8868105755475,128.636075097087
iM뱅크(구 대구은행),동대구로점,대구광역시 수성구 범어동 동대구로382,053-755-1806,수성구,35.8645345584077,128.627413253282
iM뱅크(구 대구은행),동북로점,대구광역시 북구 복현2동 동북로287,053-956-1575,북구,35.8930081022822,128.621548848212
iM뱅크(구 대구은행),동산의료원출장소,대구광역시 중구 동산동 달성로56,053-254-7290,중구,35.8701796358401,128.582523054192
iM뱅크(구 대구은행),동서변지점,대구광역시 북구 서변동 호국로209,053-958-4850,북구,35.9204633007305,128.59897964283
iM뱅크(구 대구은행),동성로지점,대구광역시 중구 덕산동 달구벌대로2105,053-425-5815,중구,35.8657726564969,128.594034687623
iM뱅크(구 대구은행),만촌동지점,대구광역시 수성구 범어동 달구벌대로2503,053-741-8771,수성구,35.8592519204419,128.636577815415
iM뱅크(구 대구은행),만촌역지점,대구광역시 수성구 만촌동 달구벌대로2626,053-742-3561,수성구,35.8566676431718,128.649667170222
iM뱅크(구 대구은행),메트로팔레스점,대구광역시 수성구 만촌동 동원로135,053-744-5680,수성구,35.8691799048805,128.633469025896
iM뱅크(구 대구은행),목련시장점,대구광역시 수성구 지산동 용학로206,053-783-0740,수성구,35.821448774663,128.630897344994
iM뱅크(구 대구은행),반야월지점,대구광역시 동구 신서동 안심로401,053-961-3061,동구,35.8695246711158,128.727904776359
iM뱅크(구 대구은행),방촌지점,대구광역시 동구 방촌동 동촌로274,053-982-1734,동구,35.8795590768919,128.669517638672
iM뱅크(구 대구은행),범물1동점,대구광역시 수성구 범물1동 지범로39길12,053-782-0357,수성구,35.8205673875903,128.643206261271
iM뱅크(구 대구은행),범어4동점,대구광역시 수성구 범어동 달구벌대로496길26,053-756-8631,수성구,35.8566988887703,128.633864879528
iM뱅크(구 대구은행),범어금융센터,대구광역시 수성구 범어동 달구벌대로2387,053-752-9883,수성구,35.8596625349187,128.623658561362
iM뱅크(구 대구은행),법원지점,대구광역시 수성구 범어동 동대구로364,053-759-6457,수성구,35.8622938688218,128.628902887504
iM뱅크(구 대구은행),복현지점,대구광역시 북구 산격3동 동북로174,053-955-2331,북구,35.8987695542579,128.611667388495
iM뱅크(구 대구은행),본리동지점,대구광역시 달서구 본동 구마로180,053-622-0801,달서구,35.8369031361309,128.547412875393
iM뱅크(구 대구은행),본점PB센터,대구광역시 수성구 수성동2가 달구벌대로2310,053-740-2222,수성구,35.8593346720137,128.614970737568
iM뱅크(구 대구은행),본점영업부,대구광역시 수성구 수성동2가 달구벌대로2310,053-755-8760,수성구,35.8593346720137,128.614970737568
iM뱅크(구 대구은행),봉덕동지점,대구광역시 남구 봉덕동 대봉로60,053-471-6381,남구,35.8440377943529,128.604200652378
iM뱅크(구 대구은행),북구청지점,대구광역시 북구 침산동 옥산로65,053-355-6915,북구,35.8856842974977,128.58278016173
iM뱅크(구 대구은행),북비산지점,대구광역시 서구 비산동 달서로183,053-555-1101,서구,35.8787031616361,128.570932982754
iM뱅크(구 대구은행),북성로지점,대구광역시 중구 수창동 서성로81,053-253-4083,중구,35.8740222356663,128.587416699313
iM뱅크(구 대구은행),삼덕금융센터,대구광역시 중구 삼덕동2가 달구벌대로2195,053-424-7235,중구,35.8634415494066,128.603440781663
iM뱅크(구 대구은행),상수도사업본부출장소,대구광역시 남구 이천동 명덕로52길45,053-475-3537,남구,35.8544555365781,128.596111912614
iM뱅크(구 대구은행),상인역지점,대구광역시 달서구 상인동 월곡로266,053-631-2301,달서구,35.8181255603283,128.538986084471
iM뱅크(구 대구은행),상인점,대구광역시 달서구 상인동 상인서로51,053-637-9501,달서구,35.8145559164729,128.543762248334
iM뱅크(구 대구은행),서구청출장소,대구광역시 서구 평리동 국채보상로257,053-557-5122,서구,35.8723387527958,128.559279224869
iM뱅크(구 대구은행),서대구지점,대구광역시 서구 평리동 서대구로78,053-565-7071,서구,35.8649170627646,128.556257828883
iM뱅크(구 대구은행),서부지원지점,대구광역시 달서구 용산동 장산남로30,053-522-3641,달서구,35.8530632739809,128.52756858872
iM뱅크(구 대구은행),서부차량등록출장소,대구광역시 달서구 이곡동 성서로400,053-593-3496,달서구,35.8533036888422,128.507861535787
iM뱅크(구 대구은행),성당뉴타운지점,대구광역시 달서구 본리동 당산로39,053-554-4261,달서구,35.8409456973268,128.544451500075
iM뱅크(구 대구은행),성당시장지점,대구광역시 남구 대명동 대경길7,053-622-3601,남구,35.849837891802,128.572399953598
iM뱅크(구 대구은행),성명지점,대구광역시 남구 대명동 대명로23,053-621-5731,남구,35.8385408102947,128.560025579345
iM뱅크(구 대구은행),성북교점,대구광역시 북구 산격1동 연암로117,053-943-3496,북구,35.8950217603851,128.594249751758
iM뱅크(구 대구은행),성서3단지영업부,대구광역시 달서구 호산동 성서공단북로132,053-591-8691,달서구,35.8441324147271,128.487221493822
iM뱅크(구 대구은행),성서공단영업부,대구광역시 달서구 월암동 성서공단로124,053-585-9541,달서구,35.83484068097,128.496174643519
iM뱅크(구 대구은행),성서비즈니스센터영업부,대구광역시 달서구 갈산동 성서공단로217,053-584-7861,달서구,35.8364554003248,128.506659007155
iM뱅크(구 대구은행),성서영업부,대구광역시 달서구 이곡동 달구벌대로1276,053-583-1351,달서구,35.8514095738308,128.506746106817
iM뱅크(구 대구은행),성서홈플러스출장소,대구광역시 달서구 용산동 달구벌대로1467,053-522-0127,달서구,35.8494536056911,128.527405810027
iM뱅크(구 대구은행),세천지점,대구광역시 달성군 다사읍 세천로3길7,053-585-4263,달성군,35.8715658288145,128.468452805187
iM뱅크(구 대구은행),수성구청지점,대구광역시 수성구 범어동 달구벌대로2450,053-744-4340,수성구,35.8582000811537,128.630629788584
iM뱅크(구 대구은행),시지지점,대구광역시 수성구 신매동 달구벌대로3196,053-793-2100,수성구,35.8401343543961,128.70616485053
iM뱅크(구 대구은행),시청영업부,대구광역시 중구 동인1가 공평로88,053-426-2161,중구,35.8715665189534,128.601258980014
iM뱅크(구 대구은행),신암동지점,대구광역시 동구 신암동 아양로2,053-943-6101,동구,35.8809941135991,128.614622467385
iM뱅크(구 대구은행),신월성지점,대구광역시 달서구 월성동 조암로5,053-639-7450,달서구,35.8255175030185,128.529130043574
iM뱅크(구 대구은행),신천4동지점,대구광역시 동구 신천동 동부로30길23-1,053-742-8590,동구,35.874995583678,128.629063165313
iM뱅크(구 대구은행),신천동지점,대구광역시 동구 신천동 송라로58,053-753-1992,동구,35.8725355937582,128.619058632731
iM뱅크(구 대구은행),신평지점,대구광역시 서구 평리동 국채보상로286,053-557-9501,서구,35.8714789770857,128.562094073794
iM뱅크(구 대구은행),안심지점,대구광역시 동구 서호동 안심로41길36,053-962-6231,동구,35.8693611585717,128.70864099805
iM뱅크(구 대구은행),연경점,대구광역시 북구 연경동 동화천로241,053-986-0370,북구,35.9426488377866,128.617378996857
iM뱅크(구 대구은행),영대병원점,대구광역시 남구 대명동 현충로170,053-625-8810,남구,35.8476701950372,128.584203505219
iM뱅크(구 대구은행),옥포점,대구광역시 달성군 옥포읍 돌미상업로2길1,053-611-6176,달성군,35.7823887984211,128.442412482032
iM뱅크(구 대구은행),용산동지점,대구광역시 달서구 용산동 용산로235,053-521-2811,달서구,35.8584911307895,128.53027118914
iM뱅크(구 대구은행),월배영업부,대구광역시 달서구 진천동 월배로109,053-636-0511,달서구,35.814787819819,128.526254526443
iM뱅크(구 대구은행),월성동지점,대구광역시 달서구 월성동 월성로30,053-635-1421,달서구,35.8315746450984,128.532312495743
iM뱅크(구 대구은행),월촌역지점,대구광역시 달서구 송현동 월배로322,053-625-2581,달서구,35.824128643689,128.546320003756
iM뱅크(구 대구은행),유통단지영업부,대구광역시 북구 산격동 유통단지로73,053-382-1400,북구,35.907952142687,128.610289815186
iM뱅크(구 대구은행),이곡동지점,대구광역시 달서구 이곡동 계대동문로124,054-437-9151,달서구,35.8550893990373,128.505909264362
iM뱅크(구 대구은행),이시아폴리스지점,대구광역시 동구 봉무동 팔공로227,053-984-0235,동구,35.9190995021191,128.6402949676
iM뱅크(구 대구은행),이현공단영업부,대구광역시 서구 중리동 국채보상로124,053-558-0301,서구,35.8685111173041,128.544746423118
iM뱅크(구 대구은행),장기점,대구광역시 달서구 장기동 장기로265,053-521-3170,달서구,35.8433411161066,128.531253303947
iM뱅크(구 대구은행),제2본점영업부,대구광역시 북구 칠성동2가 옥산로111,053-357-6871,북구,35.884469446605,128.588282751758
iM뱅크(구 대구은행),죽전지점,대구광역시 달서구 감삼동 달구벌대로1568,053-554-5715,달서구,35.8503054021362,128.538667386698
iM뱅크(구 대구은행),중구청지점,대구광역시 중구 동인동2가 국채보상로139길1,053-426-5063,중구,35.8693256621114,128.60615767581
iM뱅크(구 대구은행),중동지점,대구광역시 수성구 중동 수성로248,053-764-0051,수성구,35.8475048281191,128.61320049436
iM뱅크(구 대구은행),지산지점,대구광역시 수성구 범물2동 지범로188,053-783-0070,수성구,35.8208017792409,128.639517868315
iM뱅크(구 대구은행),차량등록사업소출장소,대구광역시 수성구 만촌동 동원로84,053-759-4532,수성구,35.8666313196369,128.63975070279
iM뱅크(구 대구은행),칠곡경북대병원점,대구광역시 북구 학정동 호국로807,053-314-4601,북구,35.9560589767245,128.565223347328
iM뱅크(구 대구은행),칠곡지점,대구광역시 북구 관음동 칠곡중앙대로451,053-323-7760,북구,35.9360034922445,128.548563176884
iM뱅크(구 대구은행),태전동지점,대구광역시 북구 태전동 칠곡중앙대로309,053-311-0961,북구,35.9233528330503,128.546465599472
iM뱅크(구 대구은행),테크노폴리스지점,대구광역시 달성군 유가읍 테크노상업로120,053-617-0981,달성군,35.6930633080128,128.462900757148
iM뱅크(구 대구은행),통일로점,대구광역시 북구 칠성2가 중앙대로507,053-355-5590,북구,35.8784013933051,128.595009659656
iM뱅크(구 대구은행),파동지점,대구광역시 수성구 상동 수성로5,053-762-5141,수성구,35.8259864765379,128.60987433848
iM뱅크(구 대구은행),파티마병원출장소,대구광역시 동구 신암동 아양로99,053-951-3852,동구,35.8838489268403,128.622991290313
iM뱅크(구 대구은행),팔달로지점,대구광역시 서구 비산동 팔달로72-1,053-356-2364,서구,35.8899293773966,128.558065968966
iM뱅크(구 대구은행),팔달영업부,대구광역시 서구 비산동 팔달로126,053-352-1201,서구,35.8891352278645,128.563831341368
iM뱅크(구 대구은행),학정로지점,대구광역시 북구 구암동 학정로432,053-326-2851,북구,35.9432406250532,128.564073187563
iM뱅크(구 대구은행),화원지점,대구광역시 달성군 화원읍 비슬로2597,053-634-2034,달성군,35.8047394164,128.500510500355
iM뱅크(구 대구은행),황금네거리지점,대구광역시 수성구 황금2동 동대구로111,053-762-6167,수성구,35.8403184248176,128.623580133841
iM뱅크(구 대구은행),황금동지점,대구광역시 수성구 황금동 청수로235,053-762-0561,수성구,35.8414481807691,128.633426593421
iM뱅크(구 대구은행),효목동지점,대구광역시 동구 효목동 효목로13,053-753-1678,동구,35.8746238774345,128.639069527474
iM뱅크(구 대구은행),효성타운점,대구광역시 남구 봉덕동 효성중앙로37,053-471-0121,남구,,
